{
  "kind": "ResourceEditor",
  "apiVersion": "ui.k8s.appscode.com/v1alpha1",
  "metadata": {
    "name": "catalog.kubeware.dev-v1alpha1-pgbouncerbindings",
    "labels": {
      "k8s.io/group": "catalog.kubeware.dev",
      "k8s.io/kind": "PgBouncerBinding",
      "k8s.io/resource": "pgbouncerbindings",
      "k8s.io/version": "v1alpha1"
    }
  },
  "spec": {
    "resource": {
      "group": "catalog.kubeware.dev",
      "version": "v1alpha1",
      "name": "pgbouncerbindings",
      "kind": "PgBouncerBinding",
      "scope": "Namespaced"
    },
    "ui": {
      "editor": {
        "name": "catalogkubewaredev-pgbouncerbinding-editor",
        "version": "v0.30.0",
        "sourceRef": {
          "apiGroup": "source.toolkit.fluxcd.io",
          "kind": "HelmRepository",
          "name": "appscode-charts-oci"
        }
      },
      "enforceQuota": false
    }
  }
}