{
  "kind": "ResourceEditor",
  "apiVersion": "ui.k8s.appscode.com/v1alpha1",
  "metadata": {
    "name": "notification.toolkit.fluxcd.io-v1beta1-alerts",
    "labels": {
      "k8s.io/group": "notification.toolkit.fluxcd.io",
      "k8s.io/kind": "Alert",
      "k8s.io/resource": "alerts",
      "k8s.io/version": "v1beta1"
    }
  },
  "spec": {
    "resource": {
      "group": "notification.toolkit.fluxcd.io",
      "version": "v1beta1",
      "name": "alerts",
      "kind": "Alert",
      "scope": "Namespaced"
    },
    "ui": {
      "editor": {
        "name": "notificationtoolkitfluxcdio-alert-editor",
        "version": "v0.30.0",
        "sourceRef": {
          "apiGroup": "source.toolkit.fluxcd.io",
          "kind": "HelmRepository",
          "name": "appscode-charts-oci"
        }
      },
      "enforceQuota": false
    }
  }
}