{
  "kind": "ResourceEditor",
  "apiVersion": "ui.k8s.appscode.com/v1alpha1",
  "metadata": {
    "name": "catalog.appscode.com-v1alpha1-pgpoolbindings",
    "labels": {
      "k8s.io/group": "catalog.appscode.com",
      "k8s.io/kind": "PgpoolBinding",
      "k8s.io/resource": "pgpoolbindings",
      "k8s.io/version": "v1alpha1"
    }
  },
  "spec": {
    "resource": {
      "group": "catalog.appscode.com",
      "version": "v1alpha1",
      "name": "pgpoolbindings",
      "kind": "PgpoolBinding",
      "scope": "Namespaced"
    },
    "ui": {
      "editor": {
        "name": "catalogappscodecom-pgpoolbinding-editor",
        "version": "v0.30.0",
        "sourceRef": {
          "apiGroup": "source.toolkit.fluxcd.io",
          "kind": "HelmRepository",
          "name": "appscode-charts-oci"
        }
      },
      "enforceQuota": false
    },
    "icons": [
      {
        "src": "https://cdn.appscode.com/k8s/icons/catalog.appscode.com/pgpoolbindings.svg",
        "type": "image/svg+xml"
      },
      {
        "src": "https://cdn.appscode.com/k8s/icons/catalog.appscode.com/pgpoolbindings.png",
        "type": "image/png"
      }
    ]
  }
}