{
  "kind": "ResourceEditor",
  "apiVersion": "ui.k8s.appscode.com/v1alpha1",
  "metadata": {
    "name": "gitops.kubedb.com-v1alpha1-ferretdbs",
    "labels": {
      "k8s.io/group": "gitops.kubedb.com",
      "k8s.io/kind": "FerretDB",
      "k8s.io/resource": "ferretdbs",
      "k8s.io/version": "v1alpha1"
    }
  },
  "spec": {
    "resource": {
      "group": "gitops.kubedb.com",
      "version": "v1alpha1",
      "name": "ferretdbs",
      "kind": "FerretDB",
      "scope": "Namespaced"
    },
    "ui": {
      "editor": {
        "name": "gitopskubedbcom-ferretdb-editor",
        "version": "v0.30.0",
        "sourceRef": {
          "apiGroup": "source.toolkit.fluxcd.io",
          "kind": "HelmRepository",
          "name": "appscode-charts-oci"
        }
      },
      "enforceQuota": false
    }
  }
}