{
  "kind": "ResourceEditor",
  "apiVersion": "ui.k8s.appscode.com/v1alpha1",
  "metadata": {
    "name": "dns.gcp.upbound.io-v1beta1-recordsets",
    "creationTimestamp": null,
    "labels": {
      "k8s.io/group": "dns.gcp.upbound.io",
      "k8s.io/kind": "RecordSet",
      "k8s.io/resource": "recordsets",
      "k8s.io/version": "v1beta1"
    }
  },
  "spec": {
    "resource": {
      "group": "dns.gcp.upbound.io",
      "version": "v1beta1",
      "name": "recordsets",
      "kind": "RecordSet",
      "scope": "Cluster"
    },
    "ui": {
      "editor": {
        "name": "dnsgcpupboundio-recordset-editor",
        "version": "v0.4.18",
        "sourceRef": {
          "apiGroup": "source.toolkit.fluxcd.io",
          "kind": "HelmRepository",
          "name": "bytebuilders-ui"
        }
      },
      "enforceQuota": false
    }
  }
}