{
  "kind": "ResourceEditor",
  "apiVersion": "ui.k8s.appscode.com/v1alpha1",
  "metadata": {
    "name": "source.toolkit.fluxcd.io-v1-gitrepositories",
    "labels": {
      "k8s.io/group": "source.toolkit.fluxcd.io",
      "k8s.io/kind": "GitRepository",
      "k8s.io/resource": "gitrepositories",
      "k8s.io/version": "v1"
    }
  },
  "spec": {
    "resource": {
      "group": "source.toolkit.fluxcd.io",
      "version": "v1",
      "name": "gitrepositories",
      "kind": "GitRepository",
      "scope": "Namespaced"
    },
    "ui": {
      "editor": {
        "name": "sourcetoolkitfluxcdio-gitrepository-editor",
        "version": "v0.30.0",
        "sourceRef": {
          "apiGroup": "source.toolkit.fluxcd.io",
          "kind": "HelmRepository",
          "name": "appscode-charts-oci"
        }
      },
      "enforceQuota": false
    }
  }
}