{
  "kind": "ResourceEditor",
  "apiVersion": "ui.k8s.appscode.com/v1alpha1",
  "metadata": {
    "name": "dynamodb.aws.kubeform.com-v1alpha1-globaltables",
    "creationTimestamp": null,
    "labels": {
      "k8s.io/group": "dynamodb.aws.kubeform.com",
      "k8s.io/kind": "GlobalTable",
      "k8s.io/resource": "globaltables",
      "k8s.io/version": "v1alpha1"
    }
  },
  "spec": {
    "resource": {
      "group": "dynamodb.aws.kubeform.com",
      "version": "v1alpha1",
      "name": "globaltables",
      "kind": "GlobalTable",
      "scope": "Cluster"
    },
    "ui": {
      "editor": {
        "name": "dynamodbawskubeformcom-globaltable-editor",
        "version": "v0.4.18",
        "sourceRef": {
          "apiGroup": "source.toolkit.fluxcd.io",
          "kind": "HelmRepository",
          "name": "bytebuilders-ui"
        }
      },
      "enforceQuota": false
    }
  }
}