{
  "kind": "ResourceEditor",
  "apiVersion": "ui.k8s.appscode.com/v1alpha1",
  "metadata": {
    "name": "cosmosdb.azure.kubeform.com-v1alpha1-gremlindatabases",
    "creationTimestamp": null,
    "labels": {
      "k8s.io/group": "cosmosdb.azure.kubeform.com",
      "k8s.io/kind": "GremlinDatabase",
      "k8s.io/resource": "gremlindatabases",
      "k8s.io/version": "v1alpha1"
    }
  },
  "spec": {
    "resource": {
      "group": "cosmosdb.azure.kubeform.com",
      "version": "v1alpha1",
      "name": "gremlindatabases",
      "kind": "GremlinDatabase",
      "scope": "Cluster"
    },
    "ui": {
      "editor": {
        "name": "cosmosdbazurekubeformcom-gremlindatabase-editor",
        "version": "v0.4.18",
        "sourceRef": {
          "apiGroup": "source.toolkit.fluxcd.io",
          "kind": "HelmRepository",
          "name": "bytebuilders-ui"
        }
      },
      "enforceQuota": false
    }
  }
}